{"$schema":"https://json-schema.org/draft/2020-12/schema","title":"Transport","type":"array","items":{"type":"object","required":["origin","destination","recommendedOption","estimatedDuration","estimatedPrice","bookingWebsite","reservationStatus","notes","options"],"properties":{"origin":{"type":"string"},"destination":{"type":"string"},"recommendedOption":{"type":"string"},"estimatedDuration":{"type":"string"},"estimatedPrice":{"type":"string"},"bookingWebsite":{"type":"string"},"reservationStatus":{"type":"string"},"notes":{"type":"string"},"options":{"type":"array","items":{"type":"object","required":["name","advantages","disadvantages","price","duration","reservation"],"properties":{"name":{"type":"string"},"advantages":{"type":"array","items":{"type":"string"}},"disadvantages":{"type":"array","items":{"type":"string"}},"price":{"type":"string"},"duration":{"type":"string"},"reservation":{"type":"string"}}}}}}}
